1,0,74.125.109.9,172.16.58.158,TCP,66,"443  >  50300 [SYN, ACK] Seq=0 Ack=1 Win=65535 Len=0 MSS=1408 SACK_PERM=1 WS=256"
2,0.044078,74.125.109.9,172.16.58.158,TCP,56,443  >  50300 [ACK] Seq=1 Ack=518 Win=66816 Len=0
3,0.045098,74.125.109.9,172.16.58.158,TLSv1.2,1462,Server Hello
4,0.046706,74.125.109.9,172.16.58.158,TCP,1462,443  >  50300 [ACK] Seq=1409 Ack=518 Win=66816 Len=1408 [TCP segment of a reassembled PDU]
5,0.047033,74.125.109.9,172.16.58.158,TCP,1462,443  >  50300 [ACK] Seq=2817 Ack=518 Win=66816 Len=1408 [TCP segment of a reassembled PDU]
6,0.053199,74.125.109.9,172.16.58.158,TLSv1.2,859,"Certificate, Server Key Exchange, Server Hello Done"
7,0.058548,74.125.109.9,172.16.58.158,TCP,859,"[TCP Retransmission] 443  >  50300 [PSH, ACK] Seq=4225 Ack=518 Win=66816 Len=805"
8,0.105857,74.125.109.9,172.16.58.158,TLSv1.2,284,"New Session Ticket, Change Cipher Spec, Encrypted Handshake Message"
9,0.139893,74.125.109.9,172.16.58.158,TCP,56,443  >  50300 [ACK] Seq=5260 Ack=2046 Win=69632 Len=0
10,0.504766,74.125.109.9,172.16.58.158,TLSv1.2,1462,Application Data
11,0.505985,74.125.109.9,172.16.58.158,TCP,1462,443  >  50300 [ACK] Seq=6668 Ack=2046 Win=69632 Len=1408 [TCP segment of a reassembled PDU]
12,0.509606,74.125.109.9,172.16.58.158,TCP,1462,443  >  50300 [ACK] Seq=8076 Ack=2046 Win=69632 Len=1408 [TCP segment of a reassembled PDU]
13,0.520113,74.125.109.9,172.16.58.158,TCP,1462,443  >  50300 [ACK] Seq=9484 Ack=2046 Win=69632 Len=1408 [TCP segment of a reassembled PDU]
14,0.531302,74.125.109.9,172.16.58.158,TCP,1462,443  >  50300 [ACK] Seq=10892 Ack=2046 Win=69632 Len=1408 [TCP segment of a reassembled PDU]
15,0.532581,74.125.109.9,172.16.58.158,TCP,1462,443  >  50300 [ACK] Seq=12300 Ack=2046 Win=69632 Len=1408 [TCP segment of a reassembled PDU]
16,0.53671,74.125.109.9,172.16.58.158,TCP,1462,443  >  50300 [ACK] Seq=13708 Ack=2046 Win=69632 Len=1408 [TCP segment of a reassembled PDU]
17,0.540673,74.125.109.9,172.16.58.158,TCP,1462,443  >  50300 [ACK] Seq=15116 Ack=2046 Win=69632 Len=1408 [TCP segment of a reassembled PDU]
18,0.546691,74.125.109.9,172.16.58.158,TCP,1462,443  >  50300 [ACK] Seq=16524 Ack=2046 Win=69632 Len=1408 [TCP segment of a reassembled PDU]
19,0.558144,74.125.109.9,172.16.58.158,TCP,1462,443  >  50300 [ACK] Seq=17932 Ack=2046 Win=69632 Len=1408 [TCP segment of a reassembled PDU]
20,0.567453,74.125.109.9,172.16.58.158,TCP,1462,443  >  50300 [ACK] Seq=19340 Ack=2046 Win=69632 Len=1408 [TCP segment of a reassembled PDU]
21,0.572681,74.125.109.9,172.16.58.158,TCP,1462,443  >  50300 [ACK] Seq=20748 Ack=2046 Win=69632 Len=1408 [TCP segment of a reassembled PDU]
22,0.590455,74.125.109.9,172.16.58.158,TCP,1462,[TCP Retransmission] 443  >  50300 [ACK] Seq=20748 Ack=2046 Win=69632 Len=1408
23,0.591022,74.125.109.9,172.16.58.158,TLSv1.2,1462,Application Data [TCP segment of a reassembled PDU]
24,0.591413,74.125.109.9,172.16.58.158,TCP,1462,443  >  50300 [ACK] Seq=23564 Ack=2046 Win=69632 Len=1408 [TCP segment of a reassembled PDU]
25,0.594538,74.125.109.9,172.16.58.158,TCP,566,443  >  50300 [ACK] Seq=24972 Ack=2046 Win=69632 Len=512 [TCP segment of a reassembled PDU]
26,0.596936,74.125.109.9,172.16.58.158,TCP,1462,443  >  50300 [ACK] Seq=25484 Ack=2046 Win=69632 Len=1408 [TCP segment of a reassembled PDU]
27,0.599452,74.125.109.9,172.16.58.158,TCP,1462,443  >  50300 [ACK] Seq=26892 Ack=2046 Win=69632 Len=1408 [TCP segment of a reassembled PDU]
28,0.609788,74.125.109.9,172.16.58.158,TCP,1462,443  >  50300 [ACK] Seq=28300 Ack=2046 Win=69632 Len=1408 [TCP segment of a reassembled PDU]
29,0.619165,74.125.109.9,172.16.58.158,TCP,950,"443  >  50300 [PSH, ACK] Seq=29708 Ack=2046 Win=69632 Len=896 [TCP segment of a reassembled PDU]"
30,0.624993,74.125.109.9,172.16.58.158,TCP,1462,443  >  50300 [ACK] Seq=30604 Ack=2046 Win=69632 Len=1408 [TCP segment of a reassembled PDU]
31,0.627101,74.125.109.9,172.16.58.158,TCP,566,[TCP Previous segment not captured] 443  >  50300 [ACK] Seq=33420 Ack=2046 Win=69632 Len=512 [TCP segment of a reassembled PDU]
32,0.642853,74.125.109.9,172.16.58.158,TCP,1462,[TCP Retransmission] 443  >  50300 [ACK] Seq=32012 Ack=2046 Win=69632 Len=1408
33,0.643269,74.125.109.9,172.16.58.158,TCP,1462,443  >  50300 [ACK] Seq=33932 Ack=2046 Win=69632 Len=1408 [TCP segment of a reassembled PDU]
34,0.644686,74.125.109.9,172.16.58.158,TCP,1462,443  >  50300 [ACK] Seq=35340 Ack=2046 Win=69632 Len=1408 [TCP segment of a reassembled PDU]
35,0.654165,74.125.109.9,172.16.58.158,TCP,950,[TCP Previous segment not captured] 443  >  50300 [ACK] Seq=38156 Ack=2046 Win=69632 Len=896 [TCP segment of a reassembled PDU] [TCP segment of a reassembled PDU]
36,0.662714,74.125.109.9,172.16.58.158,TCP,1462,[TCP Retransmission] 443  >  50300 [ACK] Seq=36748 Ack=2046 Win=69632 Len=1408
37,0.663362,74.125.109.9,172.16.58.158,TCP,1462,443  >  50300 [ACK] Seq=39052 Ack=2046 Win=69632 Len=1408 [TCP segment of a reassembled PDU]
38,0.664641,74.125.109.9,172.16.58.158,TCP,1462,443  >  50300 [ACK] Seq=40460 Ack=2046 Win=69632 Len=1408 [TCP segment of a reassembled PDU]
39,0.665174,74.125.109.9,172.16.58.158,TCP,566,443  >  50300 [ACK] Seq=41868 Ack=2046 Win=69632 Len=512 [TCP segment of a reassembled PDU]
40,0.666398,74.125.109.9,172.16.58.158,TCP,1462,443  >  50300 [ACK] Seq=42380 Ack=2046 Win=69632 Len=1408 [TCP segment of a reassembled PDU]
41,0.674196,74.125.109.9,172.16.58.158,TCP,566,443  >  50300 [ACK] Seq=43788 Ack=2046 Win=69632 Len=512 [TCP segment of a reassembled PDU]
42,0.678386,74.125.109.9,172.16.58.158,TCP,1462,443  >  50300 [ACK] Seq=44300 Ack=2046 Win=69632 Len=1408 [TCP segment of a reassembled PDU]
43,0.678388,74.125.109.9,172.16.58.158,TCP,1462,443  >  50300 [ACK] Seq=45708 Ack=2046 Win=69632 Len=1408 [TCP segment of a reassembled PDU]
44,0.695419,74.125.109.9,172.16.58.158,TCP,438,"443  >  50300 [PSH, ACK] Seq=47116 Ack=2046 Win=69632 Len=384 [TCP segment of a reassembled PDU]"
45,0.712133,74.125.109.9,172.16.58.158,TCP,1462,443  >  50300 [ACK] Seq=47500 Ack=2046 Win=69632 Len=1408 [TCP segment of a reassembled PDU]
46,0.723817,74.125.109.9,172.16.58.158,TCP,1462,443  >  50300 [ACK] Seq=48908 Ack=2046 Win=69632 Len=1408 [TCP segment of a reassembled PDU]
47,0.727319,74.125.109.9,172.16.58.158,TCP,1078,443  >  50300 [ACK] Seq=50316 Ack=2046 Win=69632 Len=1024 [TCP segment of a reassembled PDU]
48,0.727793,74.125.109.9,172.16.58.158,TCP,1462,443  >  50300 [ACK] Seq=51340 Ack=2046 Win=69632 Len=1408 [TCP segment of a reassembled PDU]
49,0.735327,74.125.109.9,172.16.58.158,TCP,1462,443  >  50300 [ACK] Seq=52748 Ack=2046 Win=69632 Len=1408 [TCP segment of a reassembled PDU]
50,0.736341,74.125.109.9,172.16.58.158,TLSv1.2,1462,Application Data [TCP segment of a reassembled PDU]
51,0.737003,74.125.109.9,172.16.58.158,TCP,438,443  >  50300 [ACK] Seq=55564 Ack=2046 Win=69632 Len=384 [TCP segment of a reassembled PDU]
52,0.742961,74.125.109.9,172.16.58.158,TCP,1462,443  >  50300 [ACK] Seq=55948 Ack=2046 Win=69632 Len=1408 [TCP segment of a reassembled PDU]
53,0.748775,74.125.109.9,172.16.58.158,TCP,566,[TCP Previous segment not captured] 443  >  50300 [ACK] Seq=58764 Ack=2046 Win=69632 Len=512 [TCP segment of a reassembled PDU]
54,0.754916,74.125.109.9,172.16.58.158,TCP,1462,[TCP Retransmission] 443  >  50300 [ACK] Seq=57356 Ack=2046 Win=69632 Len=1408
55,0.768445,74.125.109.9,172.16.58.158,TCP,1462,443  >  50300 [ACK] Seq=59276 Ack=2046 Win=69632 Len=1408 [TCP segment of a reassembled PDU]
56,0.778565,74.125.109.9,172.16.58.158,TCP,1462,443  >  50300 [ACK] Seq=60684 Ack=2046 Win=69632 Len=1408 [TCP segment of a reassembled PDU]
57,0.779005,74.125.109.9,172.16.58.158,TCP,1462,443  >  50300 [ACK] Seq=62092 Ack=2046 Win=69632 Len=1408 [TCP segment of a reassembled PDU]
58,0.779293,74.125.109.9,172.16.58.158,TCP,950,"443  >  50300 [PSH, ACK] Seq=63500 Ack=2046 Win=69632 Len=896 [TCP segment of a reassembled PDU]"
59,0.839176,74.125.109.9,172.16.58.158,TCP,1462,443  >  50300 [ACK] Seq=64396 Ack=2046 Win=69632 Len=1408 [TCP segment of a reassembled PDU]
60,0.842429,74.125.109.9,172.16.58.158,TCP,1462,443  >  50300 [ACK] Seq=65804 Ack=2046 Win=69632 Len=1408 [TCP segment of a reassembled PDU]
61,0.842867,74.125.109.9,172.16.58.158,TCP,566,443  >  50300 [ACK] Seq=67212 Ack=2046 Win=69632 Len=512 [TCP segment of a reassembled PDU]
62,0.854925,74.125.109.9,172.16.58.158,TCP,1462,443  >  50300 [ACK] Seq=67724 Ack=2046 Win=69632 Len=1408 [TCP segment of a reassembled PDU]
63,0.85657,74.125.109.9,172.16.58.158,TCP,1078,443  >  50300 [ACK] Seq=69132 Ack=2046 Win=69632 Len=1024 [TCP segment of a reassembled PDU]
64,0.861412,74.125.109.9,172.16.58.158,TCP,1462,443  >  50300 [ACK] Seq=70156 Ack=2046 Win=69632 Len=1408 [TCP segment of a reassembled PDU]
65,0.861875,74.125.109.9,172.16.58.158,TCP,1334,443  >  50300 [ACK] Seq=71564 Ack=2046 Win=69632 Len=1280 [TCP segment of a reassembled PDU] [TCP segment of a reassembled PDU]
66,0.887736,74.125.109.9,172.16.58.158,TCP,1462,443  >  50300 [ACK] Seq=72844 Ack=2046 Win=69632 Len=1408 [TCP segment of a reassembled PDU]
67,0.8927,74.125.109.9,172.16.58.158,TCP,566,443  >  50300 [ACK] Seq=74252 Ack=2046 Win=69632 Len=512 [TCP segment of a reassembled PDU]
68,0.895544,74.125.109.9,172.16.58.158,TCP,566,[TCP Previous segment not captured] 443  >  50300 [ACK] Seq=76172 Ack=2046 Win=69632 Len=512 [TCP segment of a reassembled PDU]
69,0.911927,74.125.109.9,172.16.58.158,TCP,1462,[TCP Retransmission] 443  >  50300 [ACK] Seq=74764 Ack=2046 Win=69632 Len=1408
70,0.921591,74.125.109.9,172.16.58.158,TCP,1462,443  >  50300 [ACK] Seq=76684 Ack=2046 Win=69632 Len=1408 [TCP segment of a reassembled PDU]
71,0.927947,74.125.109.9,172.16.58.158,TCP,1462,443  >  50300 [ACK] Seq=78092 Ack=2046 Win=69632 Len=1408 [TCP segment of a reassembled PDU]
72,0.939659,74.125.109.9,172.16.58.158,TCP,1462,443  >  50300 [ACK] Seq=79500 Ack=2046 Win=69632 Len=1408 [TCP segment of a reassembled PDU]
73,0.940814,74.125.109.9,172.16.58.158,TCP,438,"443  >  50300 [PSH, ACK] Seq=80908 Ack=2046 Win=69632 Len=384 [TCP segment of a reassembled PDU]"
74,0.950996,74.125.109.9,172.16.58.158,TCP,1462,443  >  50300 [ACK] Seq=81292 Ack=2046 Win=69632 Len=1408 [TCP segment of a reassembled PDU]
75,0.955949,74.125.109.9,172.16.58.158,TCP,1462,443  >  50300 [ACK] Seq=82700 Ack=2046 Win=69632 Len=1408 [TCP segment of a reassembled PDU]
76,0.958884,74.125.109.9,172.16.58.158,TCP,566,443  >  50300 [ACK] Seq=84108 Ack=2046 Win=69632 Len=512 [TCP segment of a reassembled PDU]
77,0.95929,74.125.109.9,172.16.58.158,TCP,566,[TCP Previous segment not captured] 443  >  50300 [ACK] Seq=86028 Ack=2046 Win=69632 Len=512 [TCP segment of a reassembled PDU]
78,0.965621,74.125.109.9,172.16.58.158,TCP,1462,[TCP Retransmission] 443  >  50300 [ACK] Seq=84620 Ack=2046 Win=69632 Len=1408
79,0.975096,74.125.109.9,172.16.58.158,TCP,1462,443  >  50300 [ACK] Seq=86540 Ack=2046 Win=69632 Len=1408 [TCP segment of a reassembled PDU]
80,0.97547,74.125.109.9,172.16.58.158,TCP,1078,443  >  50300 [ACK] Seq=87948 Ack=2046 Win=69632 Len=1024 [TCP segment of a reassembled PDU] [TCP segment of a reassembled PDU]
81,0.98251,74.125.109.9,172.16.58.158,TCP,822,443  >  50300 [ACK] Seq=88972 Ack=2046 Win=69632 Len=768 [TCP segment of a reassembled PDU]
82,0.985858,74.125.109.9,172.16.58.158,TCP,566,[TCP Previous segment not captured] 443  >  50300 [ACK] Seq=91148 Ack=2046 Win=69632 Len=512 [TCP segment of a reassembled PDU]
83,0.989619,74.125.109.9,172.16.58.158,TCP,1462,[TCP Retransmission] 443  >  50300 [ACK] Seq=89740 Ack=2046 Win=69632 Len=1408
84,1.001897,74.125.109.9,172.16.58.158,TCP,1078,[TCP Previous segment not captured] 443  >  50300 [ACK] Seq=93068 Ack=2046 Win=69632 Len=1024 [TCP segment of a reassembled PDU]
85,1.002377,74.125.109.9,172.16.58.158,TCP,1462,[TCP Out-Of-Order] 443  >  50300 [ACK] Seq=91660 Ack=2046 Win=69632 Len=1408 [TCP segment of a reassembled PDU]
86,1.005584,74.125.109.9,172.16.58.158,TCP,1462,443  >  50300 [ACK] Seq=94092 Ack=2046 Win=69632 Len=1408 [TCP segment of a reassembled PDU]
87,1.014056,74.125.109.9,172.16.58.158,TCP,1462,443  >  50300 [ACK] Seq=95500 Ack=2046 Win=69632 Len=1408 [TCP segment of a reassembled PDU]
88,1.018571,74.125.109.9,172.16.58.158,TCP,1334,"443  >  50300 [PSH, ACK] Seq=96908 Ack=2046 Win=69632 Len=1280 [TCP segment of a reassembled PDU]"
89,1.028303,74.125.109.9,172.16.58.158,TCP,1462,443  >  50300 [ACK] Seq=98188 Ack=2046 Win=69632 Len=1408 [TCP segment of a reassembled PDU]
90,1.029063,74.125.109.9,172.16.58.158,TCP,566,443  >  50300 [ACK] Seq=99596 Ack=2046 Win=69632 Len=512 [TCP segment of a reassembled PDU]
91,1.029255,74.125.109.9,172.16.58.158,TCP,566,[TCP Previous segment not captured] 443  >  50300 [ACK] Seq=101516 Ack=2046 Win=69632 Len=512 [TCP segment of a reassembled PDU]
92,1.040438,74.125.109.9,172.16.58.158,TCP,1462,[TCP Retransmission] 443  >  50300 [ACK] Seq=100108 Ack=2046 Win=69632 Len=1408
93,1.04173,74.125.109.9,172.16.58.158,TCP,1462,443  >  50300 [ACK] Seq=102028 Ack=2046 Win=69632 Len=1408 [TCP segment of a reassembled PDU]
94,1.04259,74.125.109.9,172.16.58.158,TCP,566,443  >  50300 [ACK] Seq=103436 Ack=2046 Win=69632 Len=512 [TCP segment of a reassembled PDU]
95,1.043974,74.125.109.9,172.16.58.158,TCP,1462,443  >  50300 [ACK] Seq=103948 Ack=2046 Win=69632 Len=1408 [TCP segment of a reassembled PDU] [TCP segment of a reassembled PDU]
96,1.050379,74.125.109.9,172.16.58.158,TCP,1078,443  >  50300 [ACK] Seq=105356 Ack=2046 Win=69632 Len=1024 [TCP segment of a reassembled PDU]
97,1.064729,74.125.109.9,172.16.58.158,TCP,310,443  >  50300 [ACK] Seq=106380 Ack=2046 Win=69632 Len=256 [TCP segment of a reassembled PDU]
98,1.064991,74.125.109.9,172.16.58.158,TCP,1462,443  >  50300 [ACK] Seq=106636 Ack=2046 Win=69632 Len=1408 [TCP segment of a reassembled PDU]
99,1.067635,74.125.109.9,172.16.58.158,TCP,1078,443  >  50300 [ACK] Seq=108044 Ack=2046 Win=69632 Len=1024 [TCP segment of a reassembled PDU]
100,1.072646,74.125.109.9,172.16.58.158,TCP,1462,443  >  50300 [ACK] Seq=109068 Ack=2046 Win=69632 Len=1408 [TCP segment of a reassembled PDU]
101,1.078713,74.125.109.9,172.16.58.158,TCP,1462,443  >  50300 [ACK] Seq=110476 Ack=2046 Win=69632 Len=1408 [TCP segment of a reassembled PDU]
102,1.080923,74.125.109.9,172.16.58.158,TCP,1078,443  >  50300 [ACK] Seq=111884 Ack=2046 Win=69632 Len=1024 [TCP segment of a reassembled PDU]
103,1.084324,74.125.109.9,172.16.58.158,TCP,822,"[TCP Previous segment not captured] 443  >  50300 [PSH, ACK] Seq=114316 Ack=2046 Win=69632 Len=768 [TCP segment of a reassembled PDU]"
104,1.087132,74.125.109.9,172.16.58.158,TCP,1462,[TCP Out-Of-Order] 443  >  50300 [ACK] Seq=112908 Ack=2046 Win=69632 Len=1408 [TCP segment of a reassembled PDU]
105,1.142634,74.125.109.9,172.16.58.158,TCP,1078,[TCP Previous segment not captured] 443  >  50300 [ACK] Seq=116492 Ack=2046 Win=69632 Len=1024 [TCP segment of a reassembled PDU]
106,1.142893,74.125.109.9,172.16.58.158,TCP,1462,[TCP Out-Of-Order] 443  >  50300 [ACK] Seq=115084 Ack=2046 Win=69632 Len=1408 [TCP segment of a reassembled PDU]
107,1.143823,74.125.109.9,172.16.58.158,TCP,1462,443  >  50300 [ACK] Seq=117516 Ack=2046 Win=69632 Len=1408 [TCP segment of a reassembled PDU]
108,1.144352,74.125.109.9,172.16.58.158,TCP,566,443  >  50300 [ACK] Seq=118924 Ack=2046 Win=69632 Len=512 [TCP segment of a reassembled PDU]
109,1.144774,74.125.109.9,172.16.58.158,TCP,1462,443  >  50300 [ACK] Seq=119436 Ack=2046 Win=69632 Len=1408 [TCP segment of a reassembled PDU]
110,1.145653,74.125.109.9,172.16.58.158,TLSv1.2,1462,Application Data [TCP segment of a reassembled PDU]
111,1.146359,74.125.109.9,172.16.58.158,TCP,1334,443  >  50300 [ACK] Seq=122252 Ack=2046 Win=69632 Len=1280 [TCP segment of a reassembled PDU]
112,1.151013,74.125.109.9,172.16.58.158,TCP,1462,443  >  50300 [ACK] Seq=123532 Ack=2046 Win=69632 Len=1408 [TCP segment of a reassembled PDU]
113,1.152324,74.125.109.9,172.16.58.158,TCP,1462,443  >  50300 [ACK] Seq=124940 Ack=2046 Win=69632 Len=1408 [TCP segment of a reassembled PDU]
114,1.170972,74.125.109.9,172.16.58.158,TCP,1462,443  >  50300 [ACK] Seq=126348 Ack=2046 Win=69632 Len=1408 [TCP segment of a reassembled PDU]
115,1.179629,74.125.109.9,172.16.58.158,TCP,1462,443  >  50300 [ACK] Seq=127756 Ack=2046 Win=69632 Len=1408 [TCP segment of a reassembled PDU]
116,1.186205,74.125.109.9,172.16.58.158,TCP,1462,443  >  50300 [ACK] Seq=129164 Ack=2046 Win=69632 Len=1408 [TCP segment of a reassembled PDU]
117,1.190021,74.125.109.9,172.16.58.158,TCP,1462,"443  >  50300 [PSH, ACK] Seq=130572 Ack=2046 Win=69632 Len=1408 [TCP segment of a reassembled PDU]"
118,1.194615,74.125.109.9,172.16.58.158,TCP,1462,443  >  50300 [ACK] Seq=131980 Ack=2046 Win=69632 Len=1408 [TCP segment of a reassembled PDU]
119,1.199617,74.125.109.9,172.16.58.158,TCP,1462,443  >  50300 [ACK] Seq=133388 Ack=2046 Win=69632 Len=1408 [TCP segment of a reassembled PDU]
120,1.201201,74.125.109.9,172.16.58.158,TCP,1462,443  >  50300 [ACK] Seq=134796 Ack=2046 Win=69632 Len=1408 [TCP segment of a reassembled PDU]
121,1.206787,74.125.109.9,172.16.58.158,TLSv1.2,1462,Application Data [TCP segment of a reassembled PDU]
122,1.209464,74.125.109.9,172.16.58.158,TCP,1462,443  >  50300 [ACK] Seq=137612 Ack=2046 Win=69632 Len=1408 [TCP segment of a reassembled PDU]
123,1.210412,74.125.109.9,172.16.58.158,TCP,1462,443  >  50300 [ACK] Seq=139020 Ack=2046 Win=69632 Len=1408 [TCP segment of a reassembled PDU]
124,1.218764,74.125.109.9,172.16.58.158,TCP,1462,443  >  50300 [ACK] Seq=140428 Ack=2046 Win=69632 Len=1408 [TCP segment of a reassembled PDU]
125,1.219373,74.125.109.9,172.16.58.158,TCP,1462,443  >  50300 [ACK] Seq=141836 Ack=2046 Win=69632 Len=1408 [TCP segment of a reassembled PDU]
126,1.228526,74.125.109.9,172.16.58.158,TCP,1462,443  >  50300 [ACK] Seq=143244 Ack=2046 Win=69632 Len=1408 [TCP segment of a reassembled PDU]
127,1.23495,74.125.109.9,172.16.58.158,TCP,1462,443  >  50300 [ACK] Seq=144652 Ack=2046 Win=69632 Len=1408 [TCP segment of a reassembled PDU]
128,1.238502,74.125.109.9,172.16.58.158,TCP,1462,443  >  50300 [ACK] Seq=146060 Ack=2046 Win=69632 Len=1408 [TCP segment of a reassembled PDU]
129,1.238991,74.125.109.9,172.16.58.158,TCP,1462,"443  >  50300 [PSH, ACK] Seq=147468 Ack=2046 Win=69632 Len=1408 [TCP segment of a reassembled PDU]"
130,1.251984,74.125.109.9,172.16.58.158,TCP,1462,443  >  50300 [ACK] Seq=148876 Ack=2046 Win=69632 Len=1408 [TCP segment of a reassembled PDU]
131,1.252549,74.125.109.9,172.16.58.158,TCP,1462,443  >  50300 [ACK] Seq=150284 Ack=2046 Win=69632 Len=1408 [TCP segment of a reassembled PDU]
132,1.262992,74.125.109.9,172.16.58.158,TCP,566,[TCP Previous segment not captured] 443  >  50300 [ACK] Seq=153100 Ack=2046 Win=69632 Len=512 [TCP segment of a reassembled PDU]
133,1.26536,74.125.109.9,172.16.58.158,TCP,1462,[TCP Out-Of-Order] 443  >  50300 [ACK] Seq=151692 Ack=2046 Win=69632 Len=1408 [TCP segment of a reassembled PDU]
134,1.268321,74.125.109.9,172.16.58.158,TLSv1.2,1462,Application Data [TCP segment of a reassembled PDU]
135,1.275709,74.125.109.9,172.16.58.158,TCP,1462,443  >  50300 [ACK] Seq=155020 Ack=2046 Win=69632 Len=1408 [TCP segment of a reassembled PDU]
136,1.277553,74.125.109.9,172.16.58.158,TCP,950,443  >  50300 [ACK] Seq=156428 Ack=2046 Win=69632 Len=896 [TCP segment of a reassembled PDU]
137,1.283402,74.125.109.9,172.16.58.158,TCP,1462,443  >  50300 [ACK] Seq=157324 Ack=2046 Win=69632 Len=1408 [TCP segment of a reassembled PDU]
138,1.28974,74.125.109.9,172.16.58.158,TCP,1462,443  >  50300 [ACK] Seq=158732 Ack=2046 Win=69632 Len=1408 [TCP segment of a reassembled PDU]
139,1.297004,74.125.109.9,172.16.58.158,TCP,1462,443  >  50300 [ACK] Seq=160140 Ack=2046 Win=69632 Len=1408 [TCP segment of a reassembled PDU]
140,1.302061,74.125.109.9,172.16.58.158,TCP,1462,443  >  50300 [ACK] Seq=161548 Ack=2046 Win=69632 Len=1408 [TCP segment of a reassembled PDU]
141,1.308545,74.125.109.9,172.16.58.158,TCP,1462,443  >  50300 [ACK] Seq=162956 Ack=2046 Win=69632 Len=1408 [TCP segment of a reassembled PDU]
142,1.312328,74.125.109.9,172.16.58.158,TCP,1462,"443  >  50300 [PSH, ACK] Seq=164364 Ack=2046 Win=69632 Len=1408 [TCP segment of a reassembled PDU]"
143,1.321773,74.125.109.9,172.16.58.158,TCP,1462,443  >  50300 [ACK] Seq=165772 Ack=2046 Win=69632 Len=1408 [TCP segment of a reassembled PDU]
144,1.331904,74.125.109.9,172.16.58.158,TCP,1462,443  >  50300 [ACK] Seq=167180 Ack=2046 Win=69632 Len=1408 [TCP segment of a reassembled PDU]
145,1.335389,74.125.109.9,172.16.58.158,TCP,1462,443  >  50300 [ACK] Seq=168588 Ack=2046 Win=69632 Len=1408 [TCP segment of a reassembled PDU]
146,1.345567,74.125.109.9,172.16.58.158,TLSv1.2,1462,Application Data [TCP segment of a reassembled PDU]
147,1.347087,74.125.109.9,172.16.58.158,TCP,1462,443  >  50300 [ACK] Seq=171404 Ack=2046 Win=69632 Len=1408 [TCP segment of a reassembled PDU]
148,1.348562,74.125.109.9,172.16.58.158,TCP,1462,443  >  50300 [ACK] Seq=172812 Ack=2046 Win=69632 Len=1408 [TCP segment of a reassembled PDU]
149,1.35048,74.125.109.9,172.16.58.158,TCP,1462,443  >  50300 [ACK] Seq=174220 Ack=2046 Win=69632 Len=1408 [TCP segment of a reassembled PDU]
150,1.357139,74.125.109.9,172.16.58.158,TCP,1462,443  >  50300 [ACK] Seq=175628 Ack=2046 Win=69632 Len=1408 [TCP segment of a reassembled PDU]
151,1.358658,74.125.109.9,172.16.58.158,TCP,1462,443  >  50300 [ACK] Seq=177036 Ack=2046 Win=69632 Len=1408 [TCP segment of a reassembled PDU]
152,1.360954,74.125.109.9,172.16.58.158,TCP,1462,443  >  50300 [ACK] Seq=178444 Ack=2046 Win=69632 Len=1408 [TCP segment of a reassembled PDU]
153,1.363046,74.125.109.9,172.16.58.158,TCP,1462,443  >  50300 [ACK] Seq=179852 Ack=2046 Win=69632 Len=1408 [TCP segment of a reassembled PDU]
154,1.364246,74.125.109.9,172.16.58.158,TCP,1462,"443  >  50300 [PSH, ACK] Seq=181260 Ack=2046 Win=69632 Len=1408 [TCP segment of a reassembled PDU]"
155,1.377165,74.125.109.9,172.16.58.158,TCP,1462,443  >  50300 [ACK] Seq=182668 Ack=2046 Win=69632 Len=1408 [TCP segment of a reassembled PDU]
156,1.379271,74.125.109.9,172.16.58.158,TCP,1462,443  >  50300 [ACK] Seq=184076 Ack=2046 Win=69632 Len=1408 [TCP segment of a reassembled PDU]
157,1.384566,74.125.109.9,172.16.58.158,TLSv1.2,1462,Application Data [TCP segment of a reassembled PDU]
158,1.403952,74.125.109.9,172.16.58.158,TCP,1462,443  >  50300 [ACK] Seq=186892 Ack=2046 Win=69632 Len=1408 [TCP segment of a reassembled PDU]
159,1.408836,74.125.109.9,172.16.58.158,TCP,1462,443  >  50300 [ACK] Seq=188300 Ack=2046 Win=69632 Len=1408 [TCP segment of a reassembled PDU]
160,1.41191,74.125.109.9,172.16.58.158,TCP,1462,443  >  50300 [ACK] Seq=189708 Ack=2046 Win=69632 Len=1408 [TCP segment of a reassembled PDU]
161,1.414743,74.125.109.9,172.16.58.158,TCP,1462,443  >  50300 [ACK] Seq=191116 Ack=2046 Win=69632 Len=1408 [TCP segment of a reassembled PDU]
162,1.415438,74.125.109.9,172.16.58.158,TCP,1462,443  >  50300 [ACK] Seq=192524 Ack=2046 Win=69632 Len=1408 [TCP segment of a reassembled PDU]
163,1.418843,74.125.109.9,172.16.58.158,TCP,1462,443  >  50300 [ACK] Seq=193932 Ack=2046 Win=69632 Len=1408 [TCP segment of a reassembled PDU]
164,1.427241,74.125.109.9,172.16.58.158,TCP,1462,443  >  50300 [ACK] Seq=195340 Ack=2046 Win=69632 Len=1408 [TCP segment of a reassembled PDU]
165,1.431354,74.125.109.9,172.16.58.158,TCP,1462,443  >  50300 [ACK] Seq=196748 Ack=2046 Win=69632 Len=1408 [TCP segment of a reassembled PDU]
166,1.434349,74.125.109.9,172.16.58.158,TCP,1462,"443  >  50300 [PSH, ACK] Seq=198156 Ack=2046 Win=69632 Len=1408 [TCP segment of a reassembled PDU]"
167,1.439803,74.125.109.9,172.16.58.158,TCP,1462,443  >  50300 [ACK] Seq=199564 Ack=2046 Win=69632 Len=1408 [TCP segment of a reassembled PDU]
168,1.441138,74.125.109.9,172.16.58.158,TCP,1462,443  >  50300 [ACK] Seq=200972 Ack=2046 Win=69632 Len=1408 [TCP segment of a reassembled PDU]
169,1.444201,74.125.109.9,172.16.58.158,TLSv1.2,1462,Application Data [TCP segment of a reassembled PDU]
170,1.444741,74.125.109.9,172.16.58.158,TCP,1462,443  >  50300 [ACK] Seq=203788 Ack=2046 Win=69632 Len=1408 [TCP segment of a reassembled PDU]
171,1.452832,74.125.109.9,172.16.58.158,TCP,1462,443  >  50300 [ACK] Seq=205196 Ack=2046 Win=69632 Len=1408 [TCP segment of a reassembled PDU]
172,1.453202,74.125.109.9,172.16.58.158,TCP,1462,443  >  50300 [ACK] Seq=206604 Ack=2046 Win=69632 Len=1408 [TCP segment of a reassembled PDU]
173,1.45804,74.125.109.9,172.16.58.158,TCP,1462,443  >  50300 [ACK] Seq=208012 Ack=2046 Win=69632 Len=1408 [TCP segment of a reassembled PDU]
174,1.459022,74.125.109.9,172.16.58.158,TCP,1462,443  >  50300 [ACK] Seq=209420 Ack=2046 Win=69632 Len=1408 [TCP segment of a reassembled PDU]
175,1.467413,74.125.109.9,172.16.58.158,TCP,1462,443  >  50300 [ACK] Seq=210828 Ack=2046 Win=69632 Len=1408 [TCP segment of a reassembled PDU]
176,1.468149,74.125.109.9,172.16.58.158,TCP,1462,443  >  50300 [ACK] Seq=212236 Ack=2046 Win=69632 Len=1408 [TCP segment of a reassembled PDU]
177,1.477319,74.125.109.9,172.16.58.158,TCP,1462,443  >  50300 [ACK] Seq=213644 Ack=2046 Win=69632 Len=1408 [TCP segment of a reassembled PDU]
178,1.479035,74.125.109.9,172.16.58.158,TCP,1462,"443  >  50300 [PSH, ACK] Seq=215052 Ack=2046 Win=69632 Len=1408 [TCP segment of a reassembled PDU]"
179,1.486495,74.125.109.9,172.16.58.158,TCP,1462,443  >  50300 [ACK] Seq=216460 Ack=2046 Win=69632 Len=1408 [TCP segment of a reassembled PDU]
180,1.487187,74.125.109.9,172.16.58.158,TCP,1462,443  >  50300 [ACK] Seq=217868 Ack=2046 Win=69632 Len=1408 [TCP segment of a reassembled PDU]
181,1.496643,74.125.109.9,172.16.58.158,TLSv1.2,1462,Application Data [TCP segment of a reassembled PDU]
182,1.497431,74.125.109.9,172.16.58.158,TCP,1462,443  >  50300 [ACK] Seq=220684 Ack=2046 Win=69632 Len=1408 [TCP segment of a reassembled PDU]
183,1.504308,74.125.109.9,172.16.58.158,TCP,1462,443  >  50300 [ACK] Seq=222092 Ack=2046 Win=69632 Len=1408 [TCP segment of a reassembled PDU]
184,1.504921,74.125.109.9,172.16.58.158,TCP,1462,443  >  50300 [ACK] Seq=223500 Ack=2046 Win=69632 Len=1408 [TCP segment of a reassembled PDU]
185,1.513051,74.125.109.9,172.16.58.158,TCP,1462,443  >  50300 [ACK] Seq=224908 Ack=2046 Win=69632 Len=1408 [TCP segment of a reassembled PDU]
186,1.513792,74.125.109.9,172.16.58.158,TCP,1462,443  >  50300 [ACK] Seq=226316 Ack=2046 Win=69632 Len=1408 [TCP segment of a reassembled PDU]
187,1.52081,74.125.109.9,172.16.58.158,TCP,1462,443  >  50300 [ACK] Seq=227724 Ack=2046 Win=69632 Len=1408 [TCP segment of a reassembled PDU]
188,1.521543,74.125.109.9,172.16.58.158,TCP,1462,443  >  50300 [ACK] Seq=229132 Ack=2046 Win=69632 Len=1408 [TCP segment of a reassembled PDU]
189,1.527938,74.125.109.9,172.16.58.158,TCP,1462,443  >  50300 [ACK] Seq=230540 Ack=2046 Win=69632 Len=1408 [TCP segment of a reassembled PDU]
190,1.532036,74.125.109.9,172.16.58.158,TCP,1462,"443  >  50300 [PSH, ACK] Seq=231948 Ack=2046 Win=69632 Len=1408 [TCP segment of a reassembled PDU]"
191,1.537933,74.125.109.9,172.16.58.158,TCP,1462,443  >  50300 [ACK] Seq=233356 Ack=2046 Win=69632 Len=1408 [TCP segment of a reassembled PDU]
192,1.542684,74.125.109.9,172.16.58.158,TLSv1.2,1462,Application Data [TCP segment of a reassembled PDU]
193,1.55075,74.125.109.9,172.16.58.158,TCP,1462,443  >  50300 [ACK] Seq=236172 Ack=2046 Win=69632 Len=1408 [TCP segment of a reassembled PDU]
194,1.551268,74.125.109.9,172.16.58.158,TCP,1462,443  >  50300 [ACK] Seq=237580 Ack=2046 Win=69632 Len=1408 [TCP segment of a reassembled PDU]
195,1.554869,74.125.109.9,172.16.58.158,TCP,1462,443  >  50300 [ACK] Seq=238988 Ack=2046 Win=69632 Len=1408 [TCP segment of a reassembled PDU]
196,1.555543,74.125.109.9,172.16.58.158,TCP,1462,443  >  50300 [ACK] Seq=240396 Ack=2046 Win=69632 Len=1408 [TCP segment of a reassembled PDU]
197,1.561327,74.125.109.9,172.16.58.158,TCP,1462,443  >  50300 [ACK] Seq=241804 Ack=2046 Win=69632 Len=1408 [TCP segment of a reassembled PDU]
198,1.56303,74.125.109.9,172.16.58.158,TCP,1462,443  >  50300 [ACK] Seq=243212 Ack=2046 Win=69632 Len=1408 [TCP segment of a reassembled PDU]
199,1.568511,74.125.109.9,172.16.58.158,TCP,1462,443  >  50300 [ACK] Seq=244620 Ack=2046 Win=69632 Len=1408 [TCP segment of a reassembled PDU]
200,1.56952,74.125.109.9,172.16.58.158,TCP,1462,443  >  50300 [ACK] Seq=246028 Ack=2046 Win=69632 Len=1408 [TCP segment of a reassembled PDU]
201,1.580694,74.125.109.9,172.16.58.158,TCP,1462,443  >  50300 [ACK] Seq=247436 Ack=2046 Win=69632 Len=1408 [TCP segment of a reassembled PDU]
202,1.58176,74.125.109.9,172.16.58.158,TCP,1462,"443  >  50300 [PSH, ACK] Seq=248844 Ack=2046 Win=69632 Len=1408 [TCP segment of a reassembled PDU]"
203,1.589328,74.125.109.9,172.16.58.158,TCP,1462,443  >  50300 [ACK] Seq=250252 Ack=2046 Win=69632 Len=1408 [TCP segment of a reassembled PDU]
204,1.593145,74.125.109.9,172.16.58.158,TLSv1.2,1462,Application Data [TCP segment of a reassembled PDU]
205,1.595103,74.125.109.9,172.16.58.158,TCP,1462,443  >  50300 [ACK] Seq=253068 Ack=2046 Win=69632 Len=1408 [TCP segment of a reassembled PDU]
206,1.600237,74.125.109.9,172.16.58.158,TCP,1462,443  >  50300 [ACK] Seq=254476 Ack=2046 Win=69632 Len=1408 [TCP segment of a reassembled PDU]
207,1.607126,74.125.109.9,172.16.58.158,TCP,1462,443  >  50300 [ACK] Seq=255884 Ack=2046 Win=69632 Len=1408 [TCP segment of a reassembled PDU]
208,1.607518,74.125.109.9,172.16.58.158,TCP,1462,443  >  50300 [ACK] Seq=257292 Ack=2046 Win=69632 Len=1408 [TCP segment of a reassembled PDU]
209,1.615406,74.125.109.9,172.16.58.158,TCP,1462,443  >  50300 [ACK] Seq=258700 Ack=2046 Win=69632 Len=1408 [TCP segment of a reassembled PDU]
210,1.616012,74.125.109.9,172.16.58.158,TCP,1462,443  >  50300 [ACK] Seq=260108 Ack=2046 Win=69632 Len=1408 [TCP segment of a reassembled PDU]
211,1.623523,74.125.109.9,172.16.58.158,TCP,1462,443  >  50300 [ACK] Seq=261516 Ack=2046 Win=69632 Len=1408 [TCP segment of a reassembled PDU]
212,1.624707,74.125.109.9,172.16.58.158,TCP,1462,443  >  50300 [ACK] Seq=262924 Ack=2046 Win=69632 Len=1408 [TCP segment of a reassembled PDU]
213,1.629171,74.125.109.9,172.16.58.158,TCP,1462,443  >  50300 [ACK] Seq=264332 Ack=2046 Win=69632 Len=1408 [TCP segment of a reassembled PDU]
214,1.629789,74.125.109.9,172.16.58.158,TCP,1462,"443  >  50300 [PSH, ACK] Seq=265740 Ack=2046 Win=69632 Len=1408 [TCP segment of a reassembled PDU]"
215,1.635018,74.125.109.9,172.16.58.158,TCP,1462,443  >  50300 [ACK] Seq=267148 Ack=2046 Win=69632 Len=1408 [TCP segment of a reassembled PDU]
216,1.636102,74.125.109.9,172.16.58.158,TLSv1.2,1462,Application Data [TCP segment of a reassembled PDU]
217,1.641916,74.125.109.9,172.16.58.158,TCP,1462,443  >  50300 [ACK] Seq=269964 Ack=2046 Win=69632 Len=1408 [TCP segment of a reassembled PDU]
218,1.643219,74.125.109.9,172.16.58.158,TCP,1462,443  >  50300 [ACK] Seq=271372 Ack=2046 Win=69632 Len=1408 [TCP segment of a reassembled PDU]
219,1.650638,74.125.109.9,172.16.58.158,TCP,1462,443  >  50300 [ACK] Seq=272780 Ack=2046 Win=69632 Len=1408 [TCP segment of a reassembled PDU]
220,1.65107,74.125.109.9,172.16.58.158,TCP,1462,443  >  50300 [ACK] Seq=274188 Ack=2046 Win=69632 Len=1408 [TCP segment of a reassembled PDU]
221,1.65842,74.125.109.9,172.16.58.158,TCP,1462,443  >  50300 [ACK] Seq=275596 Ack=2046 Win=69632 Len=1408 [TCP segment of a reassembled PDU]
222,1.664372,74.125.109.9,172.16.58.158,TCP,1462,443  >  50300 [ACK] Seq=277004 Ack=2046 Win=69632 Len=1408 [TCP segment of a reassembled PDU]
223,1.668912,74.125.109.9,172.16.58.158,TCP,1462,443  >  50300 [ACK] Seq=278412 Ack=2046 Win=69632 Len=1408 [TCP segment of a reassembled PDU]
224,1.669643,74.125.109.9,172.16.58.158,TCP,1462,443  >  50300 [ACK] Seq=279820 Ack=2046 Win=69632 Len=1408 [TCP segment of a reassembled PDU]
225,1.671538,74.125.109.9,172.16.58.158,TCP,1462,443  >  50300 [ACK] Seq=281228 Ack=2046 Win=69632 Len=1408 [TCP segment of a reassembled PDU]
226,1.672529,74.125.109.9,172.16.58.158,TCP,1462,"443  >  50300 [PSH, ACK] Seq=282636 Ack=2046 Win=69632 Len=1408 [TCP segment of a reassembled PDU]"
227,1.679809,74.125.109.9,172.16.58.158,TLSv1.2,1462,Application Data [TCP segment of a reassembled PDU]
228,1.680244,74.125.109.9,172.16.58.158,TCP,1462,443  >  50300 [ACK] Seq=285452 Ack=2046 Win=69632 Len=1408 [TCP segment of a reassembled PDU]
229,1.686505,74.125.109.9,172.16.58.158,TCP,1462,443  >  50300 [ACK] Seq=286860 Ack=2046 Win=69632 Len=1408 [TCP segment of a reassembled PDU]
230,1.689663,74.125.109.9,172.16.58.158,TCP,1462,443  >  50300 [ACK] Seq=288268 Ack=2046 Win=69632 Len=1408 [TCP segment of a reassembled PDU]
231,1.696944,74.125.109.9,172.16.58.158,TCP,1462,443  >  50300 [ACK] Seq=289676 Ack=2046 Win=69632 Len=1408 [TCP segment of a reassembled PDU]
232,1.707221,74.125.109.9,172.16.58.158,TCP,1462,443  >  50300 [ACK] Seq=291084 Ack=2046 Win=69632 Len=1408 [TCP segment of a reassembled PDU]
233,1.708033,74.125.109.9,172.16.58.158,TCP,1462,443  >  50300 [ACK] Seq=292492 Ack=2046 Win=69632 Len=1408 [TCP segment of a reassembled PDU]
234,1.715176,74.125.109.9,172.16.58.158,TCP,1462,443  >  50300 [ACK] Seq=293900 Ack=2046 Win=69632 Len=1408 [TCP segment of a reassembled PDU]
235,1.72163,74.125.109.9,172.16.58.158,TCP,1462,443  >  50300 [ACK] Seq=295308 Ack=2046 Win=69632 Len=1408 [TCP segment of a reassembled PDU]
236,1.722659,74.125.109.9,172.16.58.158,TCP,1462,443  >  50300 [ACK] Seq=296716 Ack=2046 Win=69632 Len=1408 [TCP segment of a reassembled PDU]
237,1.725901,74.125.109.9,172.16.58.158,TCP,1462,443  >  50300 [ACK] Seq=298124 Ack=2046 Win=69632 Len=1408 [TCP segment of a reassembled PDU]
238,1.727197,74.125.109.9,172.16.58.158,TCP,1462,"443  >  50300 [PSH, ACK] Seq=299532 Ack=2046 Win=69632 Len=1408 [TCP segment of a reassembled PDU]"
239,1.727912,74.125.109.9,172.16.58.158,TLSv1.2,1462,Application Data [TCP segment of a reassembled PDU]
240,1.735674,74.125.109.9,172.16.58.158,TCP,1462,443  >  50300 [ACK] Seq=302348 Ack=2046 Win=69632 Len=1408 [TCP segment of a reassembled PDU]
241,1.73819,74.125.109.9,172.16.58.158,TCP,1462,443  >  50300 [ACK] Seq=303756 Ack=2046 Win=69632 Len=1408 [TCP segment of a reassembled PDU]
242,1.74434,74.125.109.9,172.16.58.158,TCP,1462,443  >  50300 [ACK] Seq=305164 Ack=2046 Win=69632 Len=1408 [TCP segment of a reassembled PDU]
243,1.744798,74.125.109.9,172.16.58.158,TCP,1462,443  >  50300 [ACK] Seq=306572 Ack=2046 Win=69632 Len=1408 [TCP segment of a reassembled PDU]
244,1.750971,74.125.109.9,172.16.58.158,TCP,1462,443  >  50300 [ACK] Seq=307980 Ack=2046 Win=69632 Len=1408 [TCP segment of a reassembled PDU]
245,1.754973,74.125.109.9,172.16.58.158,TCP,1462,443  >  50300 [ACK] Seq=309388 Ack=2046 Win=69632 Len=1408 [TCP segment of a reassembled PDU]
246,1.755633,74.125.109.9,172.16.58.158,TCP,1462,443  >  50300 [ACK] Seq=310796 Ack=2046 Win=69632 Len=1408 [TCP segment of a reassembled PDU]
247,1.756422,74.125.109.9,172.16.58.158,TCP,1462,443  >  50300 [ACK] Seq=312204 Ack=2046 Win=69632 Len=1408 [TCP segment of a reassembled PDU]
248,1.75758,74.125.109.9,172.16.58.158,TCP,1462,443  >  50300 [ACK] Seq=313612 Ack=2046 Win=69632 Len=1408 [TCP segment of a reassembled PDU]
249,1.767316,74.125.109.9,172.16.58.158,TCP,1462,443  >  50300 [ACK] Seq=315020 Ack=2046 Win=69632 Len=1408 [TCP segment of a reassembled PDU]
250,1.768343,74.125.109.9,172.16.58.158,TCP,1462,"443  >  50300 [PSH, ACK] Seq=316428 Ack=2046 Win=69632 Len=1408 [TCP segment of a reassembled PDU]"
251,1.771033,74.125.109.9,172.16.58.158,TLSv1.2,1462,Application Data [TCP segment of a reassembled PDU]
252,1.775587,74.125.109.9,172.16.58.158,TCP,1462,443  >  50300 [ACK] Seq=319244 Ack=2046 Win=69632 Len=1408 [TCP segment of a reassembled PDU]
253,1.778649,74.125.109.9,172.16.58.158,TCP,1462,443  >  50300 [ACK] Seq=320652 Ack=2046 Win=69632 Len=1408 [TCP segment of a reassembled PDU]
254,1.786439,74.125.109.9,172.16.58.158,TCP,1462,443  >  50300 [ACK] Seq=322060 Ack=2046 Win=69632 Len=1408 [TCP segment of a reassembled PDU]
255,1.790195,74.125.109.9,172.16.58.158,TCP,1462,443  >  50300 [ACK] Seq=323468 Ack=2046 Win=69632 Len=1408 [TCP segment of a reassembled PDU]
256,1.791638,74.125.109.9,172.16.58.158,TCP,1462,443  >  50300 [ACK] Seq=324876 Ack=2046 Win=69632 Len=1408 [TCP segment of a reassembled PDU]
257,1.793229,74.125.109.9,172.16.58.158,TCP,1462,443  >  50300 [ACK] Seq=326284 Ack=2046 Win=69632 Len=1408 [TCP segment of a reassembled PDU]
258,1.796041,74.125.109.9,172.16.58.158,TCP,1462,443  >  50300 [ACK] Seq=327692 Ack=2046 Win=69632 Len=1408 [TCP segment of a reassembled PDU]
259,1.801433,74.125.109.9,172.16.58.158,TCP,1462,443  >  50300 [ACK] Seq=329100 Ack=2046 Win=69632 Len=1408 [TCP segment of a reassembled PDU]
260,1.801435,74.125.109.9,172.16.58.158,TCP,1462,443  >  50300 [ACK] Seq=330508 Ack=2046 Win=69632 Len=1408 [TCP segment of a reassembled PDU]
261,1.807609,74.125.109.9,172.16.58.158,TCP,1462,443  >  50300 [ACK] Seq=331916 Ack=2046 Win=69632 Len=1408 [TCP segment of a reassembled PDU]
262,1.808019,74.125.109.9,172.16.58.158,TLSv1.2,1462,Application Data [TCP segment of a reassembled PDU]
263,1.816828,74.125.109.9,172.16.58.158,TCP,1462,443  >  50300 [ACK] Seq=334732 Ack=2046 Win=69632 Len=1408 [TCP segment of a reassembled PDU]
264,1.817545,74.125.109.9,172.16.58.158,TCP,1462,443  >  50300 [ACK] Seq=336140 Ack=2046 Win=69632 Len=1408 [TCP segment of a reassembled PDU]
265,1.828773,74.125.109.9,172.16.58.158,TCP,1462,443  >  50300 [ACK] Seq=337548 Ack=2046 Win=69632 Len=1408 [TCP segment of a reassembled PDU]
266,1.829804,74.125.109.9,172.16.58.158,TCP,1462,443  >  50300 [ACK] Seq=338956 Ack=2046 Win=69632 Len=1408 [TCP segment of a reassembled PDU]
267,1.83252,74.125.109.9,172.16.58.158,TCP,1462,443  >  50300 [ACK] Seq=340364 Ack=2046 Win=69632 Len=1408 [TCP segment of a reassembled PDU]
268,1.833556,74.125.109.9,172.16.58.158,TCP,1462,443  >  50300 [ACK] Seq=341772 Ack=2046 Win=69632 Len=1408 [TCP segment of a reassembled PDU]
269,1.838154,74.125.109.9,172.16.58.158,TCP,1462,443  >  50300 [ACK] Seq=343180 Ack=2046 Win=69632 Len=1408 [TCP segment of a reassembled PDU]
270,1.840355,74.125.109.9,172.16.58.158,TCP,1462,443  >  50300 [ACK] Seq=344588 Ack=2046 Win=69632 Len=1408 [TCP segment of a reassembled PDU]
271,1.843578,74.125.109.9,172.16.58.158,TCP,1462,443  >  50300 [ACK] Seq=345996 Ack=2046 Win=69632 Len=1408 [TCP segment of a reassembled PDU]
272,1.845199,74.125.109.9,172.16.58.158,TCP,1462,443  >  50300 [ACK] Seq=347404 Ack=2046 Win=69632 Len=1408 [TCP segment of a reassembled PDU]
273,1.850928,74.125.109.9,172.16.58.158,TCP,1462,443  >  50300 [ACK] Seq=348812 Ack=2046 Win=69632 Len=1408 [TCP segment of a reassembled PDU]
274,1.851541,74.125.109.9,172.16.58.158,TLSv1.2,1462,Application Data [TCP segment of a reassembled PDU]
275,1.858773,74.125.109.9,172.16.58.158,TCP,1462,443  >  50300 [ACK] Seq=351628 Ack=2046 Win=69632 Len=1408 [TCP segment of a reassembled PDU]
276,1.860414,74.125.109.9,172.16.58.158,TCP,1462,443  >  50300 [ACK] Seq=353036 Ack=2046 Win=69632 Len=1408 [TCP segment of a reassembled PDU]
277,1.871583,74.125.109.9,172.16.58.158,TCP,1462,443  >  50300 [ACK] Seq=354444 Ack=2046 Win=69632 Len=1408 [TCP segment of a reassembled PDU]
278,1.878344,74.125.109.9,172.16.58.158,TCP,1462,443  >  50300 [ACK] Seq=355852 Ack=2046 Win=69632 Len=1408 [TCP segment of a reassembled PDU]
279,1.882073,74.125.109.9,172.16.58.158,TCP,1462,443  >  50300 [ACK] Seq=357260 Ack=2046 Win=69632 Len=1408 [TCP segment of a reassembled PDU]
280,1.891416,74.125.109.9,172.16.58.158,TCP,1462,443  >  50300 [ACK] Seq=358668 Ack=2046 Win=69632 Len=1408 [TCP segment of a reassembled PDU]
281,1.893567,74.125.109.9,172.16.58.158,TCP,1462,443  >  50300 [ACK] Seq=360076 Ack=2046 Win=69632 Len=1408 [TCP segment of a reassembled PDU]
282,1.895732,74.125.109.9,172.16.58.158,TCP,1462,443  >  50300 [ACK] Seq=361484 Ack=2046 Win=69632 Len=1408 [TCP segment of a reassembled PDU]
